<?xml version="1.0" encoding="ISO-8859-1" ?>
<!DOCTYPE stock SYSTEM "stock.dtd">
<stock>

<entree>
  <numero_entree>452</numero_entree>
  <numero_article>45-234</numero_article>
  <nom_article>fauteuil de bureau "ministre"</nom_article>
  <quantite_article>10</quantite_article>
  <classe_produit>C-III</classe_produit>
</entree>
<sortie>
  <numero_sortie>318</numero_sortie>
  <numero_article>37-917</numero_article>
  <nom_article>armoire à glaces  "Narcisse"</nom_article>
  <quantite_article>3</quantite_article>
  <description>F-IV</description>
</sortie>

</stock>

